{
  "id": "cn",
  "name": {
    "en": "China",
    "zh": "中国",
    "nl": "China"
  },
  "flag": "🇨🇳",
  "region": "asia",
  "wave": 4,
  "sectors": {
    "aec": {
      "collections": [
        "cn-fire-symbols",
        "iso7010-safety",
        "cn-stamps",
        "common-material-hatches",
        "common-north-arrows",
        "iec60617-electrical"
      ]
    },
    "electrical": {
      "collections": [
        "iec60617-electrical"
      ]
    },
    "process": {
      "collections": [
        "iso10628-pid"
      ]
    },
    "mep": {
      "collections": [
        "common-hvac-symbols"
      ]
    }
  }
}
