{
  "id": "il",
  "name": {
    "en": "Israel",
    "he": "ישראל",
    "nl": "Israël"
  },
  "flag": "🇮🇱",
  "region": "middle-east",
  "wave": 4,
  "sectors": {
    "aec": {
      "collections": [
        "il-fire-symbols",
        "iso7010-safety",
        "il-stamps",
        "en-steel-profiles",
        "common-material-hatches",
        "common-north-arrows"
      ]
    }
  }
}
