{
  "id": "ru",
  "name": {
    "en": "Russia",
    "ru": "Россия",
    "nl": "Rusland"
  },
  "flag": "🇷🇺",
  "region": "europe",
  "wave": 4,
  "sectors": {
    "aec": {
      "collections": [
        "ru-fire-symbols",
        "iso7010-safety",
        "ru-stamps",
        "gost-steel-shapes",
        "common-material-hatches",
        "common-north-arrows",
        "iec60617-electrical"
      ]
    },
    "electrical": {
      "collections": [
        "iec60617-electrical"
      ]
    },
    "process": {
      "collections": [
        "iso10628-pid"
      ]
    },
    "mep": {
      "collections": [
        "common-hvac-symbols"
      ]
    }
  }
}
