{
  "id": "de",
  "name": { "en": "Germany", "de": "Deutschland", "nl": "Duitsland" },
  "flag": "🇩🇪",
  "region": "europe",
  "wave": 1,
  "sectors": {
    "aec": {
      "collections": [
        "din14034-fire",
        "iso7010-safety",
        "de-drafting-parametric",
        "de-stamps",
        "de-wall-types",
        "en-steel-profiles",
        "common-material-hatches",
        "common-north-arrows"
      ]
    }
  }
}
