{
  "id": "ro",
  "name": {
    "en": "Romania",
    "ro": "România",
    "nl": "Roemenië"
  },
  "flag": "🇷🇴",
  "region": "europe",
  "wave": 3,
  "sectors": {
    "aec": {
      "collections": [
        "ro-fire-symbols",
        "ro-stamps",
        "iso7010-safety",
        "en-steel-profiles",
        "common-material-hatches",
        "common-north-arrows",
        "iec60617-electrical"
      ]
    },
    "electrical": {
      "collections": [
        "iec60617-electrical"
      ]
    },
    "process": {
      "collections": [
        "iso10628-pid"
      ]
    },
    "mep": {
      "collections": [
        "common-hvac-symbols"
      ]
    }
  }
}
