{
  "id": "no",
  "name": {
    "en": "Norway",
    "no": "Norge",
    "nl": "Noorwegen"
  },
  "flag": "🇳🇴",
  "region": "europe",
  "wave": 2,
  "sectors": {
    "aec": {
      "collections": [
        "no-fire-symbols",
        "no-stamps",
        "iso7010-safety",
        "en-steel-profiles",
        "common-material-hatches",
        "common-north-arrows",
        "iec60617-electrical"
      ]
    },
    "electrical": {
      "collections": [
        "iec60617-electrical"
      ]
    },
    "process": {
      "collections": [
        "iso10628-pid"
      ]
    },
    "mep": {
      "collections": [
        "common-hvac-symbols"
      ]
    }
  }
}
