{
  "id": "us",
  "name": { "en": "United States", "nl": "Verenigde Staten" },
  "flag": "🇺🇸",
  "region": "north-america",
  "wave": 1,
  "sectors": {
    "aec": {
      "collections": [
        "nfpa170-fire",
        "us-drafting-parametric",
        "us-stamps",
        "aisc-steel-shapes",
        "common-material-hatches",
        "common-north-arrows"
      ]
    }
  }
}
