{
  "id": "it",
  "name": {
    "en": "Italy",
    "it": "Italia",
    "nl": "Italië"
  },
  "flag": "🇮🇹",
  "region": "europe",
  "wave": 2,
  "sectors": {
    "aec": {
      "collections": [
        "it-fire-symbols",
        "iso7010-safety",
        "it-stamps",
        "en-steel-profiles",
        "common-material-hatches",
        "common-north-arrows",
        "iec60617-electrical"
      ]
    },
    "electrical": {
      "collections": [
        "iec60617-electrical"
      ]
    },
    "process": {
      "collections": [
        "iso10628-pid"
      ]
    },
    "mep": {
      "collections": [
        "common-hvac-symbols"
      ]
    }
  }
}
