{
  "id": "br",
  "name": {
    "en": "Brazil",
    "pt": "Brasil",
    "nl": "Brazilië"
  },
  "flag": "🇧🇷",
  "region": "south-america",
  "wave": 4,
  "sectors": {
    "aec": {
      "collections": [
        "br-fire-symbols",
        "iso7010-safety",
        "br-stamps",
        "common-material-hatches",
        "common-north-arrows",
        "iec60617-electrical"
      ]
    },
    "electrical": {
      "collections": [
        "iec60617-electrical"
      ]
    },
    "process": {
      "collections": [
        "iso10628-pid"
      ]
    },
    "mep": {
      "collections": [
        "common-hvac-symbols"
      ]
    }
  }
}
